by advocating new requirements for voters to show id cards at the polls republicans want to literally drag us all the way back to jim crow laws	0
we trump university have an a from the better business bureau	0
even hunters are restricted from using large capacity magazines there is a five cartridge limit for large game hunting and three for bird hunting	1
when students leave our high schools and they go to the community college 70 75 percent of them have to pay to take remedial math	1
says mitt romney called the arizona law a model for the nation	0
99 percent of all new income today is going to the top 1 percent	1
julie lassa willingly took a hefty pay raise at a time when people throughout her district and the state were losing their jobs	1
says tom steyer is acalifornia billionaire who stands to profit by blocking keystone and is spending big to help bruce braley	0
says that when president bill clinton raised the top tax rates to levels now proposed by obama the country experienced significant job growth	1
thanks to our policies for the first time in state history we have put millions of dollars into our rainy day fund in consecutive years	1
throughout his time in elected office barack obama has taken multiple positions on banning handguns and the d c handgun ban	1
homicides last year increased by 17 percent in americas 50 largest cities thats the largest increase in 25 years	1
says hillary clinton makes more per hour at a speaking gig than the average ceo does in a year	0
photos prove the denver light rail system has low ridership	0
says in january 1992 george h w bush probably had a 90 percent or even higher approval rating after the first gulf war	0
under wisconsin law anyone who knows anything about a john doe secret criminal investigation cant talk about it	1
mccain voted against renewable sources of energy against biofuels against solar power against wind power	1
the government is going to have the right to get into your bank account with the health care bill and make transfers without you knowing it	0
in harrisburg i passed more bills than all the democrats combined in terms of legislation affecting the city	1
acorn will be a paid partner with the census bureau and they will be in charge of going door to door and collecting data from the american public	0
dallas african american and hispanic students pass ap exams at a higher rate than any other place in america	1
there are still tens of thousands of missing service members from previous and current conflicts that our nation is working to find and repatriate	1
29 is what families on snap i e food stamps have to live on for a week	0
our larger domestic threat is from racial supremacist groups	0
on running a civil and polite campaign	1
on fundraising for super pacs	0
says he could be the first president in modern history to be outspent	0
kansas has not elected somebody other than a republican to the u s senate since before the wizard of oz hit the movie theaters	1
ive supported every investigation into hurricane katrina and ways of finding out how what caused the tragedy ive met with people on the ground ive met with the governor	0
the debt ceiling deal will result in the lowest level of annual domestic spending since dwight eisenhower was president	1
says rick perry wrote a letter supporting hillarycare	0
for the past year i was censored and muzzled	0
texas ranks 1 in worker deaths 1 carbon emissions 50 in high school graduates 50 in funding for mental health patients	1
aig executives took a junket for over 400 000 twice	0
were now the no 1 producer of oil in the world weve surpassed saudi arabia	1
my treasury team eliminated a 900 case backlog in the crime victim compensation program	1
says 15 000 irs employees have to be added to administer obamacare and look at the tax implications	0
when i was mayor of south pasadena we actually reduced the property taxes we collected	0
the mccain campaign did not elaborate on obama s ties to acorn	0
america is no 1 in wind power	1
the geography of poverty has changed fundamentally in the last 15 years with more of it concentrated in fragile and conflict states	1
the public option is not funded with public money it s funded with private insurance premiums	1
seventy percent of all texans are overweight or obese	1
a trump television ad shows mexicans swarming over our southern border	0
there are 60 000 fewer jobs today in this state than we had in 2008	1
art robinson says social security should be ended through attrition	1
says arkansas republican rep tom cotton voted to provide congress with taxpayer funded health care for life	0
then the republican leader theatrically introduced new bills with stopgap budget language declaring that we could stay until midnight and pass this compromise except under our constitution a bill has to be read on 3 different days so thats not possible	0
our national guard as we saw in the midwest flooding can t function as effectively as it could i was talking to national guard representatives fifteen of their 17 helicopters in this region were overseas during the flooding	0
under gov romneys definition donald trump is a small business	0
a new york imam wants tohave a mosque at ground zero	0
we rank 38th in wages rick scott goes out around the country and advertises that to other states	1
as a result of the house republican bill the nonpartisan congressional budget office now confirms that families will see their health care premiums reduced by up to 10 percent	1
says texas has the nations most uninsured residents	0
some even advocate wiping out 401 k s entirely and replacing them with government run accounts	0
the six largest cities in ohio all have higher rates of violence and crime than every major city along the u s mexico border	1
rick santorum says rick perry requested 1 200 earmarks as governor of texas	0
obama has jumped the shark and ordered the ocean closed	0
aarp is endorsing the health care reform bill	0
tarpon springs takes its homeless to st petersburg	0
i became a republican sooner in my life than ronald reagan did in his	1
eighty out of 82 counties in ohio have an auto manufacturing facility	1
superdelegates have never been a determining factor in who our nominee is since theyve been in place since 1984	1
planned parenthood is the only health care that a significant number of women get about 30 percent of women thats their health care	0
paul ryan got his start in politics as a young staffer just out of college working for then congressman john kasichs budget committee	1
no i did not have illegal immigrants working at his mansion	0
ten years ago the austin water utility used a total of 240 3 million gallons every summer since then our peak day of water use has been lower	1
says the obama administration has fulfilled all of texas requests for fire management assisting grants	1
says bill clinton opposes president barack obamas plan to raise taxes on wealthy americans	0
sayspresident obama and his allies in congress gave power to control medicare patients health care decisions to a commission of 15 unelected bureaucrats in washington	0
terry mcauliffe cashed in walking away with millions from the demise of global crossing	0
rob cornilles supports privatizing medicare	0
the latest quinnipiac poll found that nearly six in ten americans oppose obamacare 30 support the law and 57 oppose it	1
60 percent of texas 8th graders are not proficient in math only 26 have a teacher with a undergraduate major in math	1
on implementing a sales tax	0
cranstons 2014 2015 budget funds 100 percent of the local police and fire pension and other retiree benefit costs	1
by the end of governor rick perry s term he will have drained texas taxpayers of more than 360 000 to pay for the rental mansion he has been living in while the historic governor s mansion is repaired	1
health insurance costs for floridians are up 30 percent or more	0
90 percent of babies with down syndrome are aborted	1
a proposed immigration bill will bankrupt georgia if passed	0
says that when michelle fields found out that there was a security camera and that they had her on tape all of a sudden that story changed	0
says his gop challenger doug macginnitie hadnt voted in a republican primary for almost 20 years until 2008	0
theres no data that says a gun free zone has saved lives	1
mitt romney is proposing a tax plan that would give millionaires another tax break and raises taxes on middle class families by up to 2 000 a year	1
the percentage of black children born without a father in the home has risen from 7 percent in 1964 to 73 percent today due to changes from president lyndon johnsons great society	0
attorney general roy cooper refuses to do his job by not defending house bill 2 in a lawsuit	1
congressman duffy has long record of voting against va backlog fixes	0
70 percent of americans believe that we are on the wrong path	1
my office sends federal money back every year	1
if you look at the states where soccer is most popular theyre overwhelmingly blue states and the states where soccer is least popular are red states	1
despite raising taxes on the wealthy and hiking the minimum wage minnesota is creating jobs at a record pace unemployment is at a historic low median income is skyrocketing and the state has a billion dollar surplus	1
say71 percent of doctors say hillarys health concerns are serious and could be disqualifying	0
the original compromise for the confederate battle flag in south carolina was to put it on the back side of the statehouse out of public view so it would not have any appearance of sovereignty	1
the health care reform bill would make it mandatory absolutely require that every five years people in medicare have a required counseling session that will tell them how to end their life sooner	0
the ratio of people working for the government and working in manufacturing today is an almost exact reversal of the situation in 1960	1
says jennifer horn chairwoman of the n h republican party owes 92 000 in back taxes	1
if we dont spend money on a pier then that money does wipe into the general funds of the city or the county and if you send it to the county you never see it again	1
chris christie helped funnel 6 million in federal hurricane sandy money to a senior center in belleville n j a place that suffered no damage	1
says every day of a special session costs taxpayers 40 000	0
says cia director george tenet told the bush administration that the sept 11 2001 terrorist attack was coming so they did have advanced notice	0
clayton county offers the lowest operating millage rate in metro atlanta	0
richmond teachers have not gotten a raise for almost 10 years	0
says between 6 and 20 bicycles can be parked in the space required by one car	1
were the highest taxed nation in the world	0
we are now eighth in the nation in job creation we are no 1 in the midwest	1
there is no evidence that poor people abuse drugs more frequently than any other socio economic group	0
you cant pass a budget in the senate of the united states without 60 votes	0
on support for gay marriage	0
the sequester is not something that ive proposed it is something that congress has proposed	0
a mailer from the obama campaign accurately indicates that hillary clinton would force uninsured people to buy insurance even if they can t afford it	1
says the president of the university of texas has raised four year student graduation rates to 75 percent	0
texas legislation would allow teachers to kill their students if they felt it was needed	1
says marco rubios proposed college affordability overhaul would specifically benefit for profit colleges	0
half the kids coming out of college this year cant find a job or a job thats consistent with a college degree	1
during the past four years average wages have barely budged	1
says ted cruz is a supporter of legalizing people that are in this country illegally and proposed giving them work permits	0
several elected state officials have opened their homes to children in need of loving families	1
on my last trip to new hampshire i think i met the guy who founded the first and only bank since dodd frank passed since the financial crisis one bank in the country	0
a texas law says that you cant shoot bears out of the second floor of a window	0
says patrick murphy has taken more money from wall street than any other member of congress other than the speaker and the majority leader	1
says people in africa literally walk two and three hundred miles in order to vote	0
from 2000 to 2008 we averaged about five mass shootings a year were now averaging 15 so thats a three fold increase	0
gov rick scott backed the federal shutdown	0
the united states won every major battle of the vietnam war every single one	1
kids coming from an affluent background are taking advantage of all these student loan programs and grants while many middle class families with no connection to college are picking up the tab	0
because of the trans pacific partnership weve got a country like malaysia taking really serious efforts to crack down on human trafficking	1
says hillary clinton has pledged amnesty in her first 100 days and her plan will provide obamacare social security and medicare for illegal immigrants breaking the federal budget	0
in 2011 the islamic state attempted to attack fort knox	0
in libya america spent 2 billion total and didnt lose a single life	1
the united states accounted for 26 percent of worldwide military spending during the cold war but now accounts for 41 percent	1
libya supplies the oil for china we get no oil from libya	0
ronald reagans philosophy of peace through strength is why the iranians released the hostages on the same day and at the same hour that reagan was sworn in	0
says there have been well over 54 million abortions since 1973	1
he s romney the one who said that he would be to the left of teddy kennedy on gay rights	1
says president barack obama built this 16 trillion debt	0
president obama campaigned on a promise to put reproductive health care at the center of his reform plan	1
says president barack obama has said that everybody should hate the police	0
wisconsin now ranks among the top 10 states for out migration	0
for the votes that we got i think we spent on average two bucks a pop compared to 42 bucks for incumbent milwaukee county executive chris abele	0
from 05 to 09 weve had 1 100 soldiers commit suicide one every 36 hours	1
says opponent u s rep gwen moore is wisconsins most absent member of congress missing nearly 17 percent of the house votes in the second quarter of 2012	1
the democrats are responsible for the swift mindless drawdown of a military that was generations in the making	0
providence has amongst the highest tax rate s in the entire country	1
the debt comes up all the time in town meetings but its never asked in the debates its really weird it hasnt been brought up	0
says mccain voted to let governments charge rape victims for forensic exams	0
50 of hispanic students count on pell grants to pay for college	1
chile ranks third internationally in economic freedom while the u s ranks 17th	0
on running for the u s senate as an independent	1
republicans chuck grassley john boehner and john mica flip flopped on providing end of life counseling for the elderly	1
since being elected in 2002 scott walker has given back over 370 000 of his salary to the county	1
in the wake of hurricanes katrina and rita offshore drilling did not cause any real difficulties	1
says oregon is near the top or at the top of the list when it comes to capital gains tax	1
we have ten different tax brackets and if youre making 9 000 youre already in the top tax bracket	0
the massachusetts supreme court defined marriage as simply quote the establishment of intimacy i guess that would mean if you really had affection for your horse i guess you could marry your horse	0
says the federal stimulus program was ineffective because the number of jobs has actually decreased by 18 300 through july 2011	1
john mccain said he wouldn t even sit down with the government of spain a nato ally that has troops in afghanistan with us now	0
the proposed education changes will not cut one teacher s pay	1
says john cornyn dodged the draft during the vietnam war	0
sen barbara boxer passed only three bills in 18 years into law	0
the majority of austinites rent the places they live	1
we supported the first new nuclear power plant in three decades	1
the average person who gets the minimum wage in america is 35 years old	0
more than half of our unemployed ohioans have been out of work for six months or more	1
e xcise tax increases drive commerce across state lines	1
says president barack obama made unilateral changes to obamacare 38 times	1
says u s reps phil gingrey and jack kingston have even changed votes to what i voted multiple times	0
the interior department is in charge of salmon while theyre in fresh water but the commerce department handles them when theyre in saltwater	1
a man using bath salts reported that raccoons had set fire inside his home and stolen his cell phone	1
the years that i was speaker the florida house consistently offered leaner budgets than the governor offered	1
there are nearly 500 000 registered sex offenders across the country and at any one time about 100 000 are unaccounted for	0
says mitt romney pays less tax than the guys who installed his car elevators	1
im the only candidate for governor whos rolled out any policies so far	0
gov scott walkers plan to freeze pay for state employees includes a 5 4 percent raise for himself	0
wisconsin has one of the most progressive tax codes in the country	1
says carlos beruff supported charlie crist even after he switched parties	1
on transportation financing	1
the largest low wage employer is not mcdonalds or walmart but the u s government	0
says cnn reported ben carson was taking a break from campaigning and the cruz campaign forwarded that news to our volunteers	0
says a new national poll shows the majority of the american people believe we should have a gold standard for u s currency	0
we have no idea what is contained in electronic cigarette vapor	0
weve had 27 ebola outbreaks around the globe and theyve never spread outside of the confines of the countries that were initially affected	1
there have been 74 school shootings in america since sandy hook	0
in texas we created over 1 million new jobs while the rest of the nation lost over 2 million	1
some criminals have learned how to spy on americans hacking into our home computers and looking out through the video camera attached to the screen	1
more than 27 000 rhode island jobs depend on trade with canada	1
the republican governor who stood up and cut spending instead of raising taxes	1
that 59 divisions in philly had no votes for romney in 2012 is a mathematical and statistical impossibility	0
the climatic research unit e mails show that the science behind climate change has been pretty well debunked	0
says marco rubio skipped 18 defense votes including one to arm the kurds to fight isis	1
georgia has more than 700 law enforcement agencies and fewer than 20 percent of them are state certified	1
half of all americans have less than 10 000 in their savings account	1
says president barack obama is the first president weve ever had who thinks he can choose which laws to enforce and which laws to ignore	0
two years after the worst recession most of us have ever known corporate profits are up	1
since 9 11 right wing extremists incl anti abortion anti gov have killed more americans than islamic extremists	1
two million more latinos are in poverty today than when president obamatook his oath of office less than eight years ago	1
says that in 2008 president barack obama said normalization with cuba would first require liberation of all political prisoners and some basic steps toward freedom including freedom of the press political parties labor unions	1
says chris koster opposes right to work efforts because he has taken 8 million from union bosses	1
we got the highest vote count in the history of the republican party	1
eighty percent of the oil were discovering were discovering in the deep gulf of mexico	0
health insurance premiums have almost doubled since 2000	1
recently rick scott closed 30 womens health care centers across the state	0
a private company building a natural gas pipeline into florida is being forced to spend months under the review of six federal agencies	1
says paul workman authored legislation providing amnesty for illegal immigrants	1
says donald trumps presidential victory was an electoral landslide	0
says former federal reserve chairman alan greenspan said that if the workers are more insecure thats very healthy for the society because theyll serve the masters gladly and passively	0
says the new years day fiscal cliff deal reduces the deficit	1
says a rape kit can be used to clean out women basically like dilation and curettage	0
from a standpoint of the county government neither school system has received an increase in funding over the past six years	1
barack obama says hes going to reduce the long term debt and deficit by 4 trillion doesnt say how hes going to do it	0
the great wall of china built 2 000 years ago is 13 000 miles long	1
says bag litter increased after san francisco banned single use shopping bags	0
when youre white you dont know what its like to be poor	0
in wisconsin unions can essentially give unlimited contributions to political parties but business cant give any	1
bill gunter would drain millions from local public schools and give our tax dollars to private for profit schools run by out of state corporations	0
mccain voted to cut education funding against accountability standards he even proposed abolishing the department of education	0
pam bonditold a group of lobbyists shell side with corporate special interests as attorney general	0
says supreme court nominee merrick garlandvoted so the folks know in washington d c to keep guns away from private citizens	0
were the sunshine state and were hardly doing any solar energy production	1
says david rivera received a 5 000 campaign contribution from congressman spencer bachus who is currently under house ethics investigation for insider trading	1
over the last 10 years incomes for the top 1 percent have grown meanwhile the bottom half of the country theyve seen their wages stagnate	1
today if you were raised poor youre just as likely to stay poor as you were 50 years ago	1
i will keep taxes low and cut them where i can my opponent will raise them	1
ohio currently ranks 50th out of all states in income growth	1
there are literally teachers now who are getting pink slips because of sequestration	0
if you tried to pay out 1 trillion by handing it out at 1 per second it would take more than 31 000 years	1
austin has gone from being the 24th most congested city just about 10 years ago to being the fourth most congested more congested than nyc	1
says states mandated tests come from an english company	1
ten times no republican candidate for president had enough delegates to claim the nomination before the partys convention and seven of those times somebody who was not the leader of delegates was selected as the nominee of the party	1
the great recession emerged in large part because of tax policies that slashed taxes on the wealthy failed to invest in the middle class took their eyes off of wall street and created a perfect storm	0
we created 800 000 new jobs we cut the unemployment rate almost in half and today new york state has more private sector jobs than it has ever had in its history	1
three or four countries out of roughly 60 in the anti isis coalition are providing military force	1
hobby lobby provided this birth control coverage before they decided to drop it to file suit	1
all the money the department of citrus has is paid for by the citrus growers you dont save dollars by eliminating the department of citrus	1
says wisconsin gov scott walker turned a 1 billion surplus into a 2 2 billion budget deficit	0
blue cross new 90 million providence headquarters was outfitted with 25 million in decor	0
when donald trump spoke in phoenix he looked the audience in the eye and he said no were building a wall and were deporting everybody he said quote they will all be gone they will all be gone this is one of the ones where you can go to the tape on it and see what donald trump has said	1
idaho was the only republican led state in the nation that chose to partner with president obama by creating a state based marketplace under the affordable care act	0
says barack obama has the legal authority to let in really however many refugees he wants from whatever country	1
bill mccollum served as a lobbyist whose clients enabled mortgages for illegal immigrants	0
michelle nunn spent most of her childhood in perry ga	0
says that voter identification laws keep poor people from voting minorities from voting the elderly from voting students from voting	1
under the clear letter of the law justice clarence thomas must recuse himself from the case challenging the constitutionality of the health care law	1
a lot of people don t know that 50 000 americans now make their living off ebay	1
on support for gay marriage	1
92 percent of president barack obamas administration has never worked outside government	0
statistics show that more people at this time telecommute than they ride carpools mass transit bicycle or walk	1
donald trump says all mexicans are rapists	0
since 2000 when he entered politics jon husted has been on the ballot six times for three different political offices	1
says the states pension and health benefits reform includes the destruction of public sector collective bargaining rights	1
says chuck hagels nomination as defense secretary has been publicly celebrated by the iranian government	0
in the first year of the obama administration more jobs were created in the private sector than in the eight years of the bush administration	0
