nearly half of african american children under the age of 6 are living in abject poverty	1
u s rep allen west wants to bring back earmarks	0
i have the most grammys of anyone my age but i havent won one against a white person	0
the delay inschool testingwas not that of a vendor the problem was not that of the test materials itself it was the product of a cyber attack	0
if the u s didnt borrow 1 2 trillion every year to fund government operations that money would be available for entrepreneurs and business people to put to work creating jobs and building and expanding their businesses	0
the chairman of the party of florida who is an avid and outward supporter of marco rubio gets to appoint 30 of those delegates	0
he s a good man but he s a pro life liberal he s right on the pro life part but he s a liberal	1
the lack of an automatic braking system that could have prevented the philadelphia amtrak crash wasnt driven by a lack of funding it just takes a while they congress just passed it in the recent past	1
says marco rubio has the worst voting record there is today	1
says rick scotts per pupil education spending is about 200 less than what it was under charlie crist during the recession	1
the new england journal of medicine released a survey the week that president obama signed obamacare stating that over 30 percent of american physicians would leave the profession if the government took over health care	0
says republican sen john mccain won more votes for president in cuyahoga county in the 2008 general election than he did in seven states	1
says milwaukee county buses are no less safe now than a year or two ago	0
the governor does not have any power to veto a referendum on same sex marriage that would be a constitutional amendment	1
says russ feingold supported a stimulus plan that allowed a company to create 3 000 jobs in china	0
we are not producing jobs we created 80 000 jobs last month we dont talk about the jobs that we lost the net of it all is that we lost jobs	0
this is the first time in the history that weve had the raising of a debt limit also with spending cuts	0
women in ohio earn on average 77 cents for every dollar earned by a man	1
says president franklin delano roosevelt felt there wasnt a need in the public sector to have collective bargaining because the government is the people	1
in 2008 candidate barack obama attacked john mccain for proposing cuts to medicare	1
more than three quarters of the oil is gone	1
ken mercer wants sean hannity and james dobson included in social studies texts	0
ohios electricity rates are 10 percent below the national average	1
americas gun related homicide rate would be about the same as belgiums if you left out california illinois d c and new jersey places with some of the strictest gun control laws in the u s	0
amendment 2 will put almost 2 000 pot shops in florida more pot shops than walmart and walgreens combined	1
says i worked with our mayor and other commissioners to help save the school year when a budget crisis in salem threatened to cut four weeks of the school year including negotiating with teachers to work for free	0
in oregon 12 808 people were arrested for marijuana related crimes in 2012	0
george allencast the deciding votefor the 2003bushtax cuts	0
about 47 percent of able bodied people in the state of maine dont work	0
if african americans vote their percentage of the population in 2008 mississippi is suddenly a democratic state	0
says u s house candidate carlos curbelo supported raising flood insurance rates	0
we actually made history in 2010 we came the closest in 24 years to defeating frank pallone	0
says mitt romney has flip flopped on his support for president reagans policies	1
jeff atwaters bank was so weak that just a few months ago it was shut down by the fdic	1
washington politicians run social security like a ponzi scheme	0
mcdonalds workers in denmark have a union earn 45 000 year	1
twenty five percent of people in the country have said they changed their email and phone habits because of the collection of data allowed by the patriot act	1
a hidden provision in obamacare taxes sporting goods as medical devices	0
oregon house republicans jobs plan could generate more than 50 000 jobs over five years	1
there would be tens of thousands of jobs created if president barack obama approved the keystone xl pipeline	0
under the dream act after two years of higher education or military service you are eligible for citizenship once a citizen this paves the way to bring the rest of your extended family to the united states	0
president barack obama met with iranian president hassan rouhani	0
we are number one in the world when it comes to energy resources the russians are second saudi arabia is number three	1
says sherwin williams is making lead paint and poisoning people around the world	1
refinanced 232 6 million in bonds resulting in reduced debt service for the city	1
candidates for governor routinely disclose their spouses tax returns	1
says he earned the highest possible credit ratings as state treasurer	1
i lowered taxes over the last two years	1
greenlight pinellas wont take existing lanes from other vehicles	0
claims that rep sanford bishop votes similar to house speaker nancy pelosi are inaccurate	0
in the history of republican primaries ive gotten the most votes in the history of the republican party	0
one percent of the american people make over 21 percent of all the income in america that wasnt the way before george bush became president	1
under hillary clinton state department officials were sending official thank yous to people who gave to the clinton foundation	0
under obama home values in florida collapsed construction jobs were lost and the state had a high foreclosure rate	0
the baucus health care bill would drastically restrict the use of flexible spending accounts fsas in order to help pay for health care reform	1
says a u s supreme court justice suggested that some u s cases will be decided based on south african law	0
says steve kagen promised us jobs voting for the 787 billion stimulus cost another 77 000 jobs lost	0
medicaid spending declined by 1 9 percent in 2012 the second such decline in 47 years	1
students at the university of texas in austin have been advised not to wear cowboy boots or cowboy hats on halloween	0
nearly 100 000 people get shot every year thats 270 people a day and 87 dead	1
state employees havent received a raise in five or six years	1
only after news broke that our veterans are dying because of inadequate health care did harry reid and senate democrats take action	0
there will be no public funding for abortion in this legislation	1
firearms homicides are down about 40 percent since texas passed concealed gun permit law	1
says that in 2007 oregon ranked 25th or 7th from the bottom in percentage of children with untreated decay compared to 32 other states with similar data	0
2 4 million of the nih dollars was spent on origami condoms	1
on using the strategic petroleum reserve	0
rob cornilles is a tea party candidate	0
after taking hundreds of thousands of dollars from goldman sachs and other wall street banks debbie wasserman schultz has voted to prevent the consumer financial protection bureau from regulating payday loans and addressing racial discrimination in car loans	1
agriculture has always required a significant workforce from abroad	0
forty percent of the country is going to be in states that are tolerant of gay marriage or at least civil unions	1
speaker gingrich for 20 years supported a federal individual mandate for health insurance	1
says since 2000 austins tax burden rose more than 40 percent while family income rose more than 20 percent	1
the city of clarkston cant decriminalize marijuana only state legislators and congress can do that	1
in the last year wisconsin ranked third in midwest job growth	0
says his deficit plan made some adjustments to simpson bowles and were putting it forward before congress right now a 4 trillion plan	1
a government report shows that alternatives to the keystone xl pipeline are worse for the environment	1
i have never asked for a single earmark pork barrel project for my state of arizona	0
says michelle obama has 43 people on her staff nancy reagan had just 3	0
says ted cruz never denied his father was photographedwith lee harvey oswald	0
women in oregon are paid 79 cents for every dollar paid to men if the wage gap was eliminated a working woman in oregon would have enough money for 2 877 gallons of gas 72 more weeks of food for her family or nearly 12 more months of rent	1
obama says hes put forward a specific 4 trillion deficit reduction plan	1
we import more oil today than ever before	0
independent voters have a ten point margin in favor of mitt romney right now	1
a republican bill that would change john doe criminal investigations is creating exceptions in the law for politicians	1
as we near the 10th anniversary of the 9 11 terrorist attacks we should not forget that some of the hijackers used new jersey drivers licenses to board those aircraft	0
in the last decade the average income of the bottom 90 percent of all working americans actually declined the top 1 percent saw their income rise by an average of more than a quarter of a million dollars each	1
says in this next biennium the cost of primary and secondary education is going to increase by more that 1000 per student half of that 1000 500 per student is accounted for by the increased cost of pers alone	1
under the current procedure if someone on a terror watch list tries to buy a gun authorities are notified	1
congressman tom cotton is the only arkansan in congress democrat or republican to vote against disaster relief five times	1
john kitzhaber is the only pro choice candidate in the race for governor	0
a loophole still exists which allows members of congress and high powered executive branch appointees to exploit insider knowledge of the financial industry in order to turn personal profit	1
a small business in my district needed 31 different permits and fees just to be able to expand	1
says that when san francisco banned plastic grocery bags you saw the number of instances of people going to the er with things like salmonella and other related illnesses spike	0
nfl players are living on average longer than the average male	1
says hillary clinton supported north american free trade agreement and she supported chinas entrance into the world trade organization she supported the job killing trade deal with south korea she supported the trans pacific partnership	1
bp is setting up claims offices throughout the state	1
president barack obama wants to take in 250 000 people from syria	0
budget analysts say the looming tax hikes and spending cuts would take us into a recession and kill jobs	1
an amendment inserted by lawmakers into the state budget exempts scientific researchers from all state animal cruelty laws	1
every signer of the declaration of independence had no federal elected office experience	0
says that under mitt romney 89 million americans could be denied coverage if they have a pre existing condition	1
says former sen george allen voted four times to raise his own pay	1
following the catastrophic cascading collapse of major investment banks on wall street in 2007 nobody was prosecuted no hearings were held and no reforms were implemented	0
german citizens were disarmed by their government in the late 1930s which allowed the nazis to carry out their evil intentions with relatively little resistance	0
today in america 70 percent of us are earning the same or less than we were 12 years ago and this is the first time that that has happened this side of world war ii	1
says the army is spending 7 million to sponsor a nascar team	1
i did not say that i would not have them muslims in my cabinet	0
if we went back to the obesity rates that existed in 1980 that would save the medicare system a trillion dollars	0
when i talk about raising the minimum wage half of republicansagree with it	1
says close to 90 percent of the population growth in texas over the last decade was non anglo	1
former business partner robert gay says the man who helped save my daughter was mitt romney	1
says during george w bushs administration we were losing millions of jobs per month while under barack obama we have three years of gaining hundreds of thousands of jobs per month	0
says republican recall challenger jonathan steitz failed to pay his taxes	1
says mary burkes 2007 09 state budget had a tax hike of 1 8 billion costing every man woman and child in the state an extra 310	0
saudi arabia is the only muslim country out of 47 muslim majority countries where women cannot get licenses to drive	1
proposed cuts in the house farm bill mean 2 million less people on food stamps 210 000 children will not receive school lunches or breakfasts	1
the obama administration spent 205 075 in stimulus funds to relocate a shrub that sells for 16	0
a large number of the uninsured earn 75 000 or more a year	1
says bill and hillary clinton attended donald trumps last wedding	1
t he united states government and its constitution says that people can be put to death	1
saysted cruz distributed the ad showing a nude melania trump on a rug	0
recently we have seen our government debt grow by 3 4 trillion during the first 29 months of the obama administration the equivalent of about 4 billion per day	1
says the u s federal income tax rate was 0 percent until 1913	1
theres been no conclusive or specific report to say russia was trying to muddy the election	0
saysjeb bush significantly cut early voting prior to the 2008 presidential election	1
the stimulus bill includes 300 000 for a sculpture garden in miami	0
ford is moving all of their small car production to mexico	1
washington d c had some of the strictest gun laws in the country and when they passed them violence skyrocketed	1
the five taliban detainees being released from guantanamo in exchange for captured army sgt bowe bergdahl are the hardest of the hard core these are the highest high risk people	1
the benefits that were offered to me as a congressman dont even compare to the benefits that you get as a state employee i just experienced that myself theyre not nearly as good	1
in the recent house special election in florida democrats got outspent in a republican district	0
i was pretty proud of being the only guy on the stage that ever had a job in the private sector	0
says his texas election fraud investigations have resulted in 50 convictions	1
says gubernatorial candidate clay pell hasnt spent a dime on advertising	0
i have never supported cap and trade	1
research found that over the course of the existence of the brady bill ban the use of assault weapons in crimes decreased by two thirds	1
it s just outrageous that under president bush the national institutes of health have been basically decreased in funding	0
under a bill before the legislature youd have to go to court to fire an employee	0
i built that border fence in san diego and it reduced the smuggling of people and drugs by 90 percent	1
two thirds of american families rely on the mothers income to stay above the poverty level	0
this congress made history as the least productive most unpopular congress in the history of this proud nation	1
the conviction rate is almost exactly the same for whites and blacks who commit murder	0
the united states is the oldest democracy in the world	1
maj nidal hasan the man accused of the fort hood shootings was an advisor to the obama administration	0
rebuilding three high schools will benefit 40 percent of portland public school students	0
150 000 oil spill claims have been filed by floridians but only 40 percent of them have been paid	1
say that under state law systems development charges can only be spent on capital investment	1
georgia has a well deserved reputation for setting the gold standard for food safety	0
says hillary clinton is wrong to say he mocked a disabled reporter	0
every child born today inherits a 30 000 share in a national debt that stands at more than 13 trillion	1
washing your hands and covering your mouth when you cough makes a huge difference in reducing transmission of the flu	1
u s senate candidate jack kingston requested more earmarks than any other ga congressman and all ga gop members combined	1
a new law requires the usda to approve the harvest and sale of crops from genetically modified seed even if a court has ruled against the crop as being dangerous to public safety or the environment	1
in 45 out of 50 states on average men are seeing their premiums double going up 99 percent women up 62 percent	0
dan patrick called for increasing the gas tax and the state sales tax	1
says that under the new healthcare law full and part time workers will be required to buy insurance costing 375 to 1 000 a month starting in 2014	1
says u n arms treaty will mandate a new international gun registry	0
in 1998 nearly half of floridas fourth graders were functionally illiterate today 72 of them can read	1
says the media created the term polar vortex and the cold air proves the ice isnt melting	0
typical minimum wage earners in america are teenagers living with their parents in middle class families	0
under conservative leadership congress has reduced the federal deficit by 60 percent nearly 800 billion	0
hillary clintons international travels included no serious diplomacy	0
says president barack obama has been presiding over our jobs going overseas for seven years	0
pediatricians have cut down on the number and proximity of vaccines because they recognize there have been too many in too short a period of time	0
the auto companies have now repaid taxpayers every dime and more of what my administration invested in	0
says marco rubio endorsed obamacare for his own family	0
dan gelbers employment by bps law firm could disqualify him from representing florida against bp as attorney general	0
under obamacare premiums have doubled and tripled in wisconsin	1
new jersey has the second highest rate of institutionalization of people with developmental disabilities in america only texas puts more of its citizens confines more of its citizens to institutions than new jersey	1
says ron johnson helped companies ship jobs overseas	0
sen mccain was already turning his sights to iraq just days after 9 11 and he became a leading supporter of an invasion and occupation of iraq	1
scott walker supported the same transportation bill hes attacking me for he said at the time it would save the taxpayers money	0
the walton family which owns wal mart controls a fortune equal to the wealth of the bottom 42 percent of americans combined	1
appalachian power company is making record profits	0
says u s senate candidate joni ernst does not support a national minimum wage	1
60 percent of all americans do not want to see planned parenthood defunded	1
we know there are more democrats in georgia than republicans we know that for a fact	0
says hillary clinton gave up 20 percent of americas uranium supply to russia	0
there is over 20 times more energy in a proposed southside uranium mining site than there is in all the oil thats estimated to be off virginias coast	1
you know how many children in the history of the united states have died in a fire at school zero	0
an internet sweepstakes cafe is a legitimate business that has been vetted and found to be completely legal in the state	1
this president went before the united nations and castigated israel for building settlements he said nothing about thousands of rockets being rained in on israel from the gaza strip	0
social security is indeed a ponzi scheme	0
on medicare for current retirees hes cutting 716 billion from the program	1
says the senate will have a record number of female senators in 2013	1
no one thought we could get a bipartisan bill medicaid passed we did in the florida senate	0
president obama has raised taxes 19 times	1
a working woman will earn 7 70 on 10	1
says his average federal tax rate was 36 percent	1
annexation would lead to overcrowding at decaturs city schools	0
says opponent bill flores helped run a company that laid off over 3 000 workers and paid off executives with millions	0
all members of congress are required to be in obamacare but obama and members of his administration have their own gold plated health care plans that theyre in	1
my opponent here has accepted money from freddie mac fannie mae and hosted subprime mortgage seminars	1
new hampshire is currently the only state in the nation that does not have a full service veterans hospital or equivalent access	1
the health care reform law offset s 6 years of benefits with 10 years of tax increases	1
if we keep the minimum wage at the current level then single parent families earning the minimum wage at a full time job will live in poverty in new jersey	1
says the city of portland has one manager for every six front line workers	1
in the united states alone we lose more than 3 000 people a day to cancer	0
russia has more diversity in its governmental representation than we do in texas	0
epa wants to regulate the family bbq	0
mitt romney gave away his fathers inheritance	1
texas this fiscal year will have more money in reserve than the other 49 states combined	0
this is the most generous country in the world when it comes to immigration there are a million people a year who legally immigrate to the united states	1
obama served on a board with former weather underground member william ayers and that relationship with mr ayers on this board continued after 9 11	1
says that as wisconsin governor he never raised taxes	0
taking the fifth amendment in a deposition about the columbia hca hospital chain he founded means a truthful answer to the questions that rick scott was asked would incriminate him	1
the greenlight pinellas 1 cent sales tax is permanent we never get to vote on this again	1
the american people support defunding obamacare and oppose shutting down the government	0
says rep charlie bass r nh voted to raise his own pay eight times	1
john mccain has threatened extinction for north korea and sung songs about bombing iran	1
says scott walker said he wouldnt touch the state civil service system but now supports overhauling it	0
we cut taxes 24 times	1
i was never against same sex marriage	1
a record number of immigrants not from mexico are being apprehended at the border	1
on the iran nuclear deal	1
twenty four states have voter id or comparable restrictions before barack obama was elected it was two	1
the claim that we plan to set up panels of bureaucrats with the power to kill off senior citizens is a lie plain and simple	1
says its estimated that 300 babies a year are sent home from the hospital with an unrecognized congenital heart defect it is the most common birth defect in america	1
says jon runyan voted to end programs to aid homeless veterans	0
fulton county has successfully reduced the number of pregnancies among 15 to 19 year olds	1
we came out against deepwater and everybody is now paying for the project in their electric bills	0
barack obama s plan gives a driver s license to any illegal who wants one	0
the murray ryan deal is the first divided government budget agreement since 1986	0
milwaukees problems include 52 percent black male unemployment	0
in many instances peoples health care costs are more than their mortgage costs or their rent which by the way is a first in american history	0
the costs for families in the individual market for the same type of coverage that they re currently receiving would go down 14 percent to 20 percent	1
suzanne bonamici supports a plan that will cut choice for medicare advantage seniors	1
when george bush said we shouldnt investigate why the governments response to hurricane katrina was so incompetent john mccain stood with him	1
michael dukakis created jobs three times faster than mitt romney	1
the pentagon under the obama administration has just acknowledged seizing and burning the privately owned bibles of american soldiers serving in afghanistan	1
she is the only candidate who has stood by our community and immigration reform from the beginning	0
the top 1 percent of income earners paid 36 7 percent of the taxes the top 50 percent pay 97 7 percent	1
the u s army had a training program that put evangelical christians catholics and mormons in the same category of religious extremism as we do al qaida	0
suzanne bonamici votes with her party a partisan 98 percent of the time	1
says hillary clinton and tim kaine want to expand obamacare into a single payer program	0
obamacare was the republican plan in the early 90s	1
says hillaryclintons immigration platform would create totally open borders	0
there are 100 members of the u s senate fifty seven of them including russ feingold are lawyers there are zero manufacturers and one accountant	1
says stores will be barred from selling 100 watt light bulbs as of 2012	0
barack obama is more to the left of the announced socialist in the united states senate	0
sixteen thousand new internal revenue service agents will be empowered to enforce the new health care legislation	0
any child born prematurely according to the president in his own words can be killed	0
says mitt romney has refused to say whether he would have vetoed or signed the lilly ledbetter fair pay act	1
we have 50 state lobbyists that just lobby the legislature for money every year	1
mitt romney is worth at least a quarter billion dollars and the bulk of his wealth remains in blind trusts and overseas bank accounts	1
most of the newspapers that endorsed alex sink also endorsed barack obama	1
there isnt a single texas legislator under the age of 30 even though millennials make up 25 percent of the electorate in texas	1
spending of government money is 17 percent less than it was a decade ago	1
says president abrahamlincoln tried to arm the slaves	0
the health care numbers are going up	0
