the u s deficit increases at 3 million per second	0
the 3 6 billion deficit we inherited has turned into more than a half billion dollar surplus	1
i dont know anything about david duke	0
a hundred percent of all the jobs lost during the recession have been reclaimed in texas while the nation is at about 36 percent	1
gm has repaid our government loan in full with interest five years ahead of the original schedule	1
an effort to repeal voting reform legislation would be the first time in ohio history where a bill has been passed to stop a referendum	1
says julie parrish voted to divert 160 million from public schools to private for profit schools	0
says the treasury department says 41 percent of all business income reported on individual returns would be hit by the millionaires surtax that would harm small businessmen and women the very people we are counting on to create new jobs	0
a year since the recovery summer there has been been a fall winter and spring of no recovery	0
we re also cutting a forest service economic development program that strayed so far from any mission that it funded a music festival	0
john mccain fought to rein in fannie and freddie but democrats blocked the reforms	1
fcat tests account for less than 1 percent of the instructional time provided during the year	0
marco rubio wants to raise the social security retirement age and cut benefits	1
regarding sexual assault against women its actually safer not to be in college than it is to be in college	0
four years as a congressman he u s rep hank johnson never talked about marta	0
there has not been a democratic woman in congress from new jersey in almost four decades	1
a college loan is the only loan in the united states that you cannot refinance when interest rates go down	1
says new jerseys 1 billion horse racing industry employs 13 000 individuals and ensures the preservation of 176 000 acres of horse farmland	1
the seed of muslim is passed through the father	0
says donald trump said at the republican convention i alone can fix it	1
says president obama is reducing our naval fleet to 1917 levels	0
redskins is used historically as a term of respect	0
i was the most bipartisan senator in the united states senate	1
says sen rob portman said it would be irresponsible not to cut medicare	1
theres a tremendous other number of public officials who have done the same thing as hillary clinton with a private email server	0
100 000 in stimulus funds were used for a martini bar and brazilian steakhouse	1
but if my opponent had his way the millions of floridians who rely on it would ve had their social security tied up in the stock market this week	0
marijuana is less addictive than both alcohol and tobacco	1
says in the legislature mary nolan has been a party line democrat showing a 100 track record in harmony with the american civil liberties union	1
under the cash for clunkers program all we ve got to do is go to a local junkyard all you ve got to do is tow it to your house and you re going to get 4 500	0
the red sox waited 87 long years to win the world series	0
says president barack obama carried congressional district 13 by 8 2 points in 2008 and 5 6 points in 2012	0
he has ushered in 3 billion in new investment	0
says mitt romney and paul ryan want to turn medicare into a voucher system	1
georgia is now the eighth most populous state in the nation moving from the number 10 position in just four years	1
women account for 92 3 percent of the jobs lost under obama	0
says an investigative report concluded ken cuccinelli should have been prosecuted for disclosure violations but virginias law was too weak	0
tuition free public universities and colleges are just a pipe dream false they were both free up until the vietnam war	0
says we brought crime rate down by 30 percent when he was mayor of dallas	1
says he took down the mob in northeast ohio	0
obama skips out on condemning left wing attacks on gen petraeus despite casting other important votes earlier and later in the day	1
joe straus is the first jewish speaker of the texas house	1
u s rep phil gingrey gave the government the power to electronically spy on americans without a warrant	0
three years ago a newly elected president obama told america that if congress approved his plan to borrow nearly a trillion dollars he would hold unemployment below 8 percent	0
says canada has one tenth of our populationyet it issues far more high skilled visas more than 150 000 yearly than we do 65 000	1
it is just a fact that hamas apparently the north american spokesperson is endorsing senator obama	1
we have more scientists and engineers per square mile than anywhere in the world	1
if the sellwood bridge is not replaced it will have to be shut down within eight years	0
says a gun bill before the senate is proposing the universal registration of all firearms and their owners	0
says 13 texas universities have announced or implemented a 10 000 degree	0
seven of americas 10 wealthiest counties are in the washington d c area	1
there are more atheists in the country right now than jews muslims hindus and buddhists combined and doubled	0
chris sununu supported obamas common core agenda taking away local control of our schools	0
report 3 million votes in presidential election cast by illegal aliens	0
the federal health care law tells the american people precisely what type of coverage they have to have	1
says donald trump and mike pence want to gamble with your retirement benefits in the stock market	0
says ted cruz wanted to let in more syrian refugees and give amnesty to illegal immigrants	1
by the time you drink your coffee an elephant is killed for its ivory tusks	1
says 315 000 mostly minority texas students are enrolled in failing schools	1
says bill white is refusing to debate	0
says rick scott gave a deposition in which he invoked the fifth amendment 75 times about his dealings as head of columbia hca hospital chain	1
russ feingold voted against the law that protected our lakes and was the only great lakes senator to vote no	0
the job of correctional officer lowers your life expectancy metropolitan did a study in i believe it was 1998 and the life expectancy was 58	0
what president has the worst record on female labor force participation barack obama	0
obama has no experience or background at all in national security affairs	0
under the federal controlled substance act marijuana is listed in the same schedule i as heroin even though marijuana is not a killer drug like heroin	1
you worked hard for your money and you paid your taxes when you earned it now indiana republican congressional candidate todd young wants to tax it again when you spend it	1
the charleston s c shootershould have never been given a gun but the universal background check was not fast enough	1
says scott walker enacted the biggest cuts to education in our states history	1
the earth is not warming	0
says in the last five years senate republicans have placed a filibuster on every piece of legislation and every nominee	0
ive either balanced every budget or we turned back a surplus	0
we have cut our deficits by almost three quarters	1
while in the illinois senate barack obama passed legislation moving people from welfare to jobs	1
barack obama had 150 days in the u s senate where he was able to vote quite often present	0
says mike enzi is getting about 84 percent of his campaign funds from washington based pacs thats more than any senator of either party	1
the democrats in the senate and some members of congress defended what fannie and freddie were doing they resisted any change	1
barack obama is in an economy thats only worsened since hes been president of the united states	1
house republicans are ramming through legislation to classify pizza as a vegetable for the purpose of school lunches	1
sherrod brown was just voted two years in a row the most liberal senator in the united states of america and is more liberal than sen bernie sanders	1
obama voted to support president bush between 40 and 50 percent of the time over the past two years	1
its legal to sign a recall petition against gov scott walker even if you have already signed another recall petition but only one signature counts	1
welfare programs caused more long term damage to detroit than the atomic bomb caused to hiroshima	0
the reason 29 states no longer have a death tax is that the tax damaged their economic competitiveness	0
we ve got some 37 million of our fellow citizens who are living in poverty about 12 million or 13 million are children	1
on the last night of the general assembly by 11 oclock 95 to 98 percent of the business was done so we really didnt have that late night session we were just holding on one bill	0
president obamas lawsuit claims it is unconstitutional for ohio to allow servicemen and women extended early voting privileges during the states early voting period	0
judge sotomayor has said that policy is made on the u s court of appeals	1
the turnout on may 14th was just 7 percent the lowest turnout in decades	1
sharron angle would eliminate the department of education	1
six people in florida die as a result of not expanding medicaid every day	1
says he balanced the budget without raising taxes	0
president barack obama reduced the cost of prescription drugs for nearly 3 6 million americans in 2011	1
obama has chosen to deny the vicious anti semitic motivation of the attack on a kosher jewish grocery in paris	0
we are only inches away from ceasing to be a free market economy	0
says state sens greg evers nancy detert and charles dean got a failing grade from conservatives	0
the profit from automated traffic enforcement cameras is going to the private corporations not to the city or state	0
says texas ranks first among the states in the amount of carbon dioxide emitted and toxic chemicals released into water	1
they delayed my swearing in here in massachusetts for a couple weeks so they could ram the health care law through	0
obama voted to cut off funding for our american troops on the battlefield	0
says wisconsin gov scott walker doesnt make his calendar public hes on our dime and we dont know where he is	1
just 9 percent of muslims in pakistan viewisis favorably unfortunately that 9 percent is 16 million people and thats just one country	1
i have never voted for a tax increase	0
the ohio democratic party has raised 1 1 million since the november election a very small percentage of that has come from organized labor	1
barack obama refuses to acknowledge jerusalem as the capital of israel	1
say water fluoridation started in nazi germany ghettos and death camps to pacify the jews	0
president barack obama suggested on national tv that the democratic health care bill will have government decide that a healthy 100 year old woman in need of a pacemaker should take a pain pill instead	0
the fbi has reopened its investigation into hillary clinton and discovered another 650 000 emails	1
we had a bill in florida where we now are prohibiting doctors to talk particularly pediatricians to talk to their patients about gun safety in the home	0
says justice elena kagan recused herself in many cases where she had little role as solicitor general simply because of the appearance of a conflict of interest	1
on auditing the federal reserve	1
over the last 10 years texas created 33 percent of the net new jobs nationwide	1
if you printed a 1 bill for the entirety of the 14 1 trillion national debt the resulting pile of money would weigh more than 136 aircraft carriers	1
wendy davis is the most popular politician in texas	0
kasim reed has kept every promise he made as a candidate	1
trade deals threaten indias role as the pharmacy of the developing world for new hiv medicines	1
says rejecting federal aid to expand medicaid in texas will send 9 billion in federal taxes paid by texans to other states to insure their working poor	0
never once did they house republicans actually cut spending or reduce the state budget even when they cut taxes in 2005 they increased spending they never paid for their tax cuts	1
when hillary clinton ran the state department 6 billion was missing how do you miss 6 billion you ran the state department 6 billion was either stolen they dont know	0
in 2006 i went out and authored a letter with 24 other senators asking for major reform of freddie and fannie warning of a meltdown and a bubble in the housing market	0
says for the duration of this recession not a single person in government middle management has lost a job or taken a pay cut	0
in the do nothing senate there are 352 house bills sitting on harry reids desk awaiting action including 55 introduced by democrats	1
after the auto bailout general motors is back on top as the worlds no 1 automaker	1
the white house branded the memorial service for the tucson shootings with a together we thrive logo and slogan	0
an audit of the last census found that over 370 000 people living in texas were not counted and our state lost an estimated 1 billion in federal funds as a result	0
no other public or private business in america except for the u s postal service must fund 100 percent of employee retirement and retirement health costs in advance	1
says gov chris christie has embarked on a tour to demand that new jerseys democratic legislature approve an immediate tax cut that would disproportionately benefit the wealthiest	0
senate democrats who left the state for weeks to delay a vote on union bargaining power exercised a wisconsin filibuster provided by the states constitution	0
st pete beachs experiences are a fair example of what could happen if amendment 4 passes	1
documents released from the soviet union show the soviet union started treating president ronald reagan more seriously after reagan fired the air traffic controllers	0
freshman rep bob gibbs is spending his one year anniversary on vacation only working 6 days in all of january	0
i asked then secretary of state condoleezza rice how many people had died and she did not know the answer to that question	0
amanda murphy has two vacation homes around the world	0
mitch mcconnell opposed legislation to create and protect kentucky jobs help for the unemployed health care for kentucky s children and fair pay for women	0
nearly 60 percent of women who use birth control do so for more than just family planning	1
says president abraham lincoln enforced the fugitive slave act until the civil war ended	0
oil companies haven t touched 68 million acres where they already have rights to drill	0
says marilinda garcia supports 150 billion in new taxes	0
the cost saving measures we put into place at columbia hca drove down national health care inflation from 18 to 8 in seven years	0
sanctuary cities such as philadelphia refuse to cooperate with the federal government in locating suspected terrorists who are in their custody and are in the country illegally	1
murder went up when romney was governor robbery went up violent crimes went up	1
on a cap and trade plan	0
every one of the mass shootings except two in america since 1950 have been in gun free zones	1
the sequester wont consider whether were cutting some bloated program that has outlived its usefulness or a vital service that americans depend on every single day it doesnt make those distinctions	1
when we go to vote they ask for drivers license and verify that you are a voter and a citizen in the state of texas	1
says jeanne shaheen voted for a measure that would have amounted to a new national energy tax	0
recent solar energy policies in georgia have resulted in rate hikes and did not result in solar becoming any more economically viable	0
the prosecution of state sen don balfour cost less than 100 excluding prosecutors salaries	1
of the 13 bill clinton speeches that fetched 500 000 or more only two occurred during the years his wife was not secretary of state	1
says state senate leaders have accepted 142 400 in campaign contributions from dentists and pharmacists during the past two years	1
roy barnes is like barack obama because theyre both doing a lot of apologizing	1
the rifle used by omar mateen shoots off 700 rounds in a minute	0
like marco rubio sen barack obama had one of the worst attendance records in the senate	1
bill mccollum also voted for numerous amendments to weaken the legislation even voting to make trains less accessible to those in wheelchairs	1
police officers in this state have that right to check the immigration status of people they arrest	1
if you sell your house after 2012 you will pay a 3 8 percent sales tax on it	0
we have more people working in the state of new jersey today than weve ever had in our history	0
when the constitution was written only 20 to 25 percent of the people in the country could vote	1
donald trump said he was excited for the 2008 housing crash that devastated millions of american families because he thought it would help him scoop up more real estate on the cheap	1
says allegations that he made unwanted sexual advances on a female sheriffs deputy were found by two separate judges to not have merit	0
says u s senate candidate tammy baldwin proposed a 3 9 trillion tax increase a tax increase so extreme that even nancy pelosi voted against it	1
workers in the united states are making less than they were almost 20 years ago and yet they are working harder	0
weve seen local union after local union rush to their school boards their city councils their technical school boards and rush through contracts in the past two weeks that had no contributions to the pension and no contribution to health care	0
the city of houston now has more debt per capita than california	1
says donald trump has given more money to democratic candidates than republican candidates	0
should democrats get their way every income tax bracket will increase on jan 1 2011 every single one	0
weve introduced a bill that includes 12 billion in cuts over the next week	1
any floridian who has ever requested an absentee ballot henceforth gets one automatically	0
says millions of dollars in tax breaks were paid for by busting unions cutting badgercare and raising taxes on the poor and the middle class thanks to elizabeth coggs help	0
by age 65 the average woman will have lost 431 000 throughout her working career was a result of the pay gap	1
sen george lemieux voted to let oil companies off the hook and overturn pollution rules	1
obama couldn t have afforded his home without rezko s help	0
once people become citizens under the dream act and turn 21 they can sponsor their illegal immigrant parents for legalization	1
our children do not spend any time in school learning about our own u s constitution	0
obama opposed exploring for energy in alaska	1
mcdonalds hamburgers are only 15 percent real beef the other 85 percent is meat filler cleansed with ammonia which causes stomach and intestinal cancer	0
this is the worst jobs recovery since the great depression	0
theaffordable care actalters the sensible doctor patient relationship centered health care program we see today	0
says gm used taxpayer dollars to prop up operations in china	0
after initially agreeing with republicans on an amount for zika funding democrats derailed it	1
in 1913 it was legal to mail children	0
there is debate among constitutional scholars about whether the first amendment will continue to protect faith leaders from being forced to perform marriages against their religious beliefs	0
15 years ago cancer drugs cost an average of 10 000 a year now its 10 000 a month	1
it costs 10 000 a year to keep a child in school it costs 30 000 a year to keep someone in prison	1
jobs that involve the minimum wage are overwhelmingly jobs for young people starting out in the workforce	0
president ronald reagan sent troops into conflict only in one circumstance which was in grenada we were in a peacekeeping setting in lebanon	0
u s sen kay bailey hutchison has voted nine separate times to raise the national debt ceiling	1
mitt romney has 15 homes	0
the trans pacific partnership was designed for china to come in as they always do through the back door and totally take advantage of everyone	0
one of the biggest polluters in our country is the milwaukee metropolitan sewerage district	0
there are cities and counties in georgia that dont have websites and where elected officials dont have email addresses	1
says there are ohio turnpike workers getting paid 66 000 a year to collect tolls that machines might collect	1
in the 1980s the lowest income people had the biggest gains	0
under obamacare 75 percent of small businesses now say they are going to be forced to either fire workers or cut their hours	0
at the beginning of the last decade america had a budget surplus of over 200 billion by the time i took office we had a one year deficit of over 1 trillion and projected deficits of 8 trillion over the next decade	1
says the estate tax is a threat to family farms	0
mike martinez has voted to raise taxes and utility rates while ending free bus service for seniors	1
fifty six percent decline in overall crime a 73 percent decline in motor vehicle theft a 67 percent decline in robbery a 66 percent decline in murder this is way beyond what happened in the nation during this period of time crime rudy giuliani attorney new york republican 9 11 10 7 3 new york n y 5122 json mostly true in 1958 there were 16 states in this country that prohibited prohibited an african american and a caucasian from being married civil rights gays and lesbians marriage sheila oliver assemblywoman new jersey democrat 0 1 1 3 0 a news conference 11191 json true says donald trump has changed his mind on abortion abortion carly fiorina california republican 5 5 4 3 2 the first republican presidential debate 10315 json mostly true it has been many years if ever since an inmate has completed his or her high school diploma while incarcerated in a state correctional facility for adults corrections and updates criminal justice public safety lc buster evans assistant commissioner georgia none 0 0 0 1 0 in a press release 1964 json mostly true says u s rep michael mccaul is the sixth richest person in congress candidates biography ted ankrum retired texas democrat 0 1 0 1 0 a speech 624 json true mccain is raising campaign cash with one of jack abramoff s closest business partners scandal plagued conservative activist ralph reed	1
on day one six people were able to sign up for health insurance through the federal marketplace	1
the poorest counties in the u s are in appalachia and happen to be more than 90 percent white	1
when terrorists killed more than 250 americans in lebanon under ronald reagan the democrats didnt make that a partisan issue	1
says kids who start in the ninth grade in the city of newark this past september 23 percent of them will graduate in four years	0
we cut property taxes for seniors and our middle class	1
about 800 people refused to get a drug screening because they are out there on drugs	0
i never proposed privatizing the milwaukee county airport	1
obama s plan for health care reform ends exorbitant out of pocket expenses deductibles or co pays	1
last year exxonmobil made 19 billion in profit guess what they paid zero in taxes they got a 156 million refund from the irs	0
hillary clinton says she wants to raise taxes on the middle class	0
in the last two years we have reduced the deficit by 2 5 trillion	0
says that as wisconsin governor we ended welfare	1
alison alter got an f in attendance in 2016 as an austin parks board member and was removed by a unanimous vote of the austin city council	0
i have a very conservative voting record	1
isis is making millions of dollars a week selling libyan oil	0
john mccain has given erratic and inconsistent answers on when troops should return from iraq	0
a bag of cheetos costs less to buy than an apple and in some milwaukee neighborhoods good luck trying to find an apple or a banana or some sort of healthy option	1
big rooftop solars plan forces nevada families who dont have solar panels to pay higher power bills to subsidize rooftop solar	1
says ohio law gives tax breaks to rich people who own private jets	1
three years after getting the 100 million from mark zuckerberg less than two thirds of students in cory bookers newark graduate	0
senator obama has the most liberal voting record in the united states senate	0
one man new castle del county executive chris coons thought property taxes should be hiked almost 50 percent	1
says hes taken an 8 pay decrease in each of the nine years he has been in office	1
here in florida ive slashed government by 10 percent that s 7 billion	0
i helped to invent a system that saved over a billion dollars on welfare	1
if you look at states that are right to work they constantly do not have budget deficits and they have very good business climates	0
democrats rang up a 1 42 trillion budget deficit in 2009 the single largest in american history	1
to vote in mexico every eligible mexican citizen has to have a tamper proof photo id card with a thumbprint and an embossed hologram	1
i believe we should have tax on carbon and deal aggressively with climate change that is not hillary clintons position	1
tim kaine as governor proposed tax increases on people earning as little as 17 000	1
on a single payer healthcare system	1
property taxes are now 18 higher than when mark sharpe first took office	0
says paul ryans budget relies on the same 700 billion in savings from medicare that mitt romney and other republicans have been attacking democrats about	1
when we look at the number of murders in the united states in 2009 we had 9 500 people murdered when we look around the world we see large countries the u k germany japan had 200 or less killed in a year	1
says hesso bipartisan that 12 of my bills were signed into law by democratic president bill clinton	1
u s global aids spending helped reduce political instability and violence by 40 percent in recipient nations	0
