fewer than 10 percent of those in the house are what anyone would classify as wealthy	0
its taken more time to complete the towpath trail than it did to build the ohio erie canal	1
the republican controlled wisconsin assembly approved only one out of 376 amendments offered by assembly democrats in 2011	1
on whether the governor of massachusetts should be able to appoint an interim u s senator	0
there are 30 000 people that have been killed with seat belts	0
late changes to the arizona immigration law lay to rest questions over the possibility of racial profiling	0
if an iranian woman shows too much hair in public she risks being beaten or killed	0
the agriculture department estimates that roughly 42 percent of the corn crop will be used to make ethanol more than the amount of corn used to feed livestock and poultry in the united states	1
america owns 3 percent of the worlds oil but consumes 25 percent of its global reserves	1
says under president barack obama the debt increased by 23 percent which was less than under any president going back to ronald reagan	0
obama voted against funding our troops	1
you can absolutely get a gun if you have several felonies as long as you buy it on the internet or at a gun show	1
a law was passed apparently in the clinton administration about whether in recruiting offices marines or other military should be able to have guns apparently it is prohibited	0
the keystone oil pipeline would employ 20 000 people in the united states	0
people were hopeless sixty percent of the population 70 percent of the population wanted to live somewhere else by the time i left 70 percent wanted to stay	0
says he and mitt romney agreed on tying minimum wage increases to inflation	1
mccain voted 19 times against a minimum wage increase	1
i was able to go and buy an automatic weapon most people can go out and buy an automatic weapon	0
says opponents of the health care law prevailed on our two main arguments to the u s supreme court	1
floridas high school graduation rates continue to increase at the fastest rate in the nation with florida leading the nation in the rate of hispanic graduates	1
rob portman shares radical ideological views toward women	0
richard burr voted to protect tax breaks for companies that ship jobs overseas but voted against a tax break to help working people	1
there are already more american jobs in the solar industry than in coal mining	1
the u s only ranks 25th worldwide on defense spending as a percentage of gdp	0
for a young man or woman who is entering the ninth grade in newark this year they have a 29 percent graduation rate	0
says hillary clinton is proposing destroying medicare for seniors	0
lincoln was fervently making plans to send all freed slaves to the jungles of central america once the civil war was over the only thing that kept this from happening was his assassination	0
president barack obama attended an islamic madrassa	0
austin is burdened by the fastest growing tax increases of any major city in the nation	0
i was the first member of congress to call him barack obama a socialist	0
the number of illegal immigrants in the united states is 30 million it could be 34 million	0
because of barack obama the mission in iraq ended	1
i left the city with 43 million in the bank	0
common core is being used by the obama administration to turn the department of education into what is effectively a national school board	0
offshore wind power is significantly less expensive than solar energy	1
says alex sink even supported a tax on homeowners insurance policies	1
ninety five percent of all the wages in texas are above minimum wage	1
a bill to aid state and local governments is fully paid for by closing costly corporate tax loopholes	0
says president obama has doubled the deficit	0
says obama promised unemployment would never go above 8 percent	0
more than a quarter of mortgage borrowers are underwater and 11 percent of all homes are vacant	1
the party in the white house is responsible for a massive tax increase on the middle class	0
the average homeowner spends more than 2 000 each year on energy costs more than on either real estate taxes or homeowners insurance	1
i think a little less than half of the people in our prisons are in there for less than a year we have people who are check kiters and dont pay child support and we are locking them up in the state pen	1
on allowing shelby countys schools merger commission to finish work before allowing any new merger legislation	0
unions did not create the eight hour work day and the 40 hour work week henry ford did	0
about 230 000 people that were on unemployment when i took office are not on unemployment now	1
under a proposed bill a 100 000 homes flood insurance premium would be maybe 200 or 300 annually	0
the fact is voter fraud is rampant	0
says texas passed a state dream act before any other state	1
as far as standing committees we have 10 fewer standing committees so weve saved the state about a quarter of a million dollars through the reduction of the standing committees	0
a state agency wanted to fire an employee who spent four hours per day watching pornography but the state employment commission reinstated the person	1
says hb2 hasnt moved the needle one iota on north carolinas economy	0
mr hurt would re open that darn medicare doughnut hole	1
im not a conspiracy theorist and i never allow conspiracy theorists on my program	0
e mployment in gwinnett is up more than 3 percent over last year and unemployment is the lowest of the five core metro counties	1
giving money to politicians has paid off for paul workman workman gave thousands to politicians and got millions in government construction projects	0
it is a fact that it costs more to run the schools in august	0
lindsey graham endorsed charlie crist for u s senate	0
twelve judges have thrown out legal challenges to the health care law because they rejected the notion that the health care law was unconstitutional	0
because gov chris christie vetoed a 30 bill job creation package new jersey ranks 50th in the nation in job creation	0
ezekiel emanuel one of president obama s key health care advisers says medical care should be reserved for the nondisabled so watch out if you re disabled	0
a white family is likely to have about six times as much wealth than a black or hispanic family coming out of the recession	1
hydrogen sulfide was used in the genocide of jews in germany	0
says michele bachmann said the chinese built a great wall 5 000 years ago you dont see any illegal mexicans in china	0
wisconsin is not as obese as the national average is the national average 35 7 percent of the population is obese in wisconsin its closer to 26 percent	0
repeal of obamacare would take away health care for 10 3 million americans who have received coverage since oct 1 2013	1
says tammy baldwin supports a law in which government will take over your decisions on medicine on doctors and on hospitals	0
two weeks ago a man entered the worlds busiest airport in atlanta georgia carrying a loaded ar 15 automatic weapon with an extended capacity 100 round magazine	1
heroin comes in the united states from the southern border	1
says u s sen ron johnson opposes faster broadband internet in small towns and got nearly 90 000 in campaign contributions from the telecom special interests	1
todays marijuana is 300 percent to 800 percent more potent than the pot of yesteryear	1
in our community college system state cuts have reduced funding per student by 1 908	1
let me say that i dont think bernie sanders has had a single negative ad ever run against him	0
says wisconsin state senate president michael elllis r neenah broke senate rules during debate on a photo id bill for voters	0
in just 17 years spending for social security federal health care and interest on the debt will exceed all tax revenue	1
says a poll shows that without a name attached democrats are just one point behind gov john kasich	1
mccain got more money from airbus u s executives than any other politician	1
in catherine cortez mastos last term as attorney general nevada murder went up 11 percent robbery went up 28 percent rape 51 percent when cortez masto left office nevada ranked as americas third most dangerous state	0
david simpson actually voted for drivers licenses for illegal immigrants	0
david jolly has used money and power to try to drill off our beaches	0
says when rhode island lottery was proposed state residents were enticed to vote for it with the promise that the money would be used for education	0
hartsfield jacksons new international terminal is opening within budget	0
says jeanne shaheen got behind the idea of using the irs to target american citizens for their political views	0
atlanta is the no 1 trading point for sexual slavery in america between 100 and 200 girls are sold into slavery in atlanta every month	1
theyve seen employer supported coverage increase in massachusetts after this law romneycare was implemented	1
greg abbott has benefitted from payday lenders who have given him 300 000 and then received a ruling from him that they can operate in a loophole in the law that allows them to charge unlimited rates and fees	1
the trans pacific partnership knocks out 18 000 tariffs that other countries place on american products and goods	1
obama regime planned the influx of illegal alien children at the border	0
says state rep jim keffer a gop lieutenant to house speaker joe straus did mail pieces for democrat mark strama to help him defeat a republican	1
by the time i left the state department economic growth was up and opium production was down in afghanistan while infant mortality declined and school enrollment rose by more than sevenfold	1
in 2009 yost spent 2 5 times more money than it took to run the prosecutors office before he got there	1
says barack obama said if we keep talking about the economy were going to lose	0
states still face a mandate to expand medicaid coverage under president obamas health care reform law	0
virginias banning of felons from voting is a jim crow era law	0
more texans have new jobs today than the entire population of fort worth	1
six years after unionization 20 000 fewer children in illinois were being served by the child care and development fund program	0
says president obamas proposed oil tax would cost consumers 24 cents a gallon	1
ive also offered a plan that can help fix social security thats supported by robert reich secretary of labor previously in a previous administration	0
we dont show people playing these games we dont show them winning playing the video lottery games	0
if the supreme court throws out the federal health care law it would be an unprecedented extraordinary step of overturning a law that was passed by a strong majority of a democratically elected congress	0
we balanced the budget with the 1997 balanced budget act and ultimately had four consecutive balanced budgets	1
as mayor every year i was in office i did reduce taxes	1
on the president unilaterally authorizing a military attack that does not involve stopping an actual or imminent threat to the nation	0
on the accuracy of state jobs numbers	0
says bill nelson cast the deciding vote for obamacare cutting medicare spending by 700 billion and letting an unelected board decide what gets covered here	0
28 percent of kentuckians dont have any online access	1
women and men both are making less when you adjust for inflation than when john kitzhaber was first elected governor	0
sen mccain s economic plan gives nearly 4 billion in tax breaks to the oil companies but doesn t provide any tax relief to more than 100 million middle class families	0
says president barack obama was responsible for the assassination of at least four american citizens in drone strikes	1
the non profit groupfeeding america is lying when it claimsthat one in five kids is fighting starvation daily in the united states	0
for every 1 spent on mitigation 4 in post storm cleanup and rebuilding is saved	1
says studies show the average age of entry into prostitution is 12 to 14 years old	1
roadside bombs are responsible for 70 percent of casualties in iraq and these new mine resistant vehicles can reduce those casualties by two thirds	1
says judges are using shariah law in dearborn mich	0
gm and chrysler repaid their loans	1
says republican approved changes to make it more difficult to participate in ohio elections include reducing in person early voting from 35 days to six	1
no one claims the report vindicating new jersey gov chris christie in the bridge scandal is conclusive	0
thanks to restrictive and anticompetitive ballot laws candidates in november 2014 ran unopposed in nearly half of wisconsins state representative races but in michigan and minnesota nearly all races had challengers	1
says catherine cortez masto failed nevada rape victims while attorney general thousands of rape kits were never sent for dna analysis	1
our tax rates are lower now than they were under ronald reagan theyre much lower than they were under dwight eisenhower	1
says u s senate candidate eric hovde has no problem with raising taxes	0
this parent trigger legislation was drafted by president obamas top advisers it was drafted by president clintons top advisers	0
the five guantanamo detainees swapped for bowe bergdahl are back on the battlefield	0
says under president barack obama the united states has created five million jobs	1
says our national debt is greater than our gross domestic product	1
put simply less government spending equals more private sector jobs	1
the increase in the garbage tax that mayor allan fung imposed in cranston for some people has been as much as 200	0
weve seen the increase of alcohol use for underage kids even though alcohol has been illegal for kids under 21	0
says hillary clinton sent a memo to all state department staff that said you should not do state department business on personal email	1
in about three weeks over a half million floridians are going to lose their coverage again through obamacare	1
studies show that if we opened one reserve in alaska now in five years gas prices could be at 2 a gallon	0
weare picking up oil with shovels and paper and plastic bags	1
says an obama administration policy prohibits people who work with at risk youth from promoting marriage as a way to avoid poverty	0
over 300k home owner suicides attributed to foreclosures	0
in florida theyre already talking about how the ryan romney plan will end medicare and replace it with a voucher	0
says ronald reagan repeatedly talked about how irresponsible it would be to allow the full faith and credit of the united states to be impaired in any kind of way	1
blue cross blue shield cancelled all their individual health care policies in the state of texas effective dec 31	0
the aclu has filed a suit to have all military cross shaped headstones removed	0
when it comes to aid the united states is still about half as what european countries give as a percentage	1
say the ratio of ceo pay to average worker pay in the u s is 475 to 1	0
says state comptroller matthew boxer pointed out that many towns are artificially lowering the real estate values that they report to trenton in order to get hundreds of millions of dollars of additional school aid this is the kind of fraud that needs to be addressed immediately	0
since rick perry became governor texas has gone from 46th in the country to 50th in the population that graduates from high school	1
saysjosh mandels campaign is under fbi investigation	0
says a liberal immigration reform group endorsed his gop primary opponent dave brat	0
says state sen randy hopper r fond du lac unlike typical taxpayers didnt pay taxes	0
says he has never received any contributions from the koch brothers	0
seneca jones timber co aiming to increase logging and allay fears that old growth will be cut says mills have shifted to second generation trees an ad from the company asks do you know that most all mills in oregon have retooled over the past 20 years	1
there was a loss of eight million jobs during the bush eight years	0
its a good sign for obamacare that in california the proportion of kids who are signing up is the proportion of kids in the population	1
says ted cruz said while there may have been an age difference josh duggars transgressions are far less an affront to god than what gays do to each other	0
the republican party has the worst reputation in american polling of any political party in history	1
says many people ive talked to are angry that because of city hall inaction we may have to spend a needless 500 million to cover and treat our pure drinking water	0
for six years i served our community as a conservative state legislator in every one of those years i helped balance the state s budget	0
an illegal immigrant who gains admission at a public college takes class space away from students who are legal residents	1
georgia has lost more than 124 000 jobs and the unemployment rate has increased since the stimulus passed	1
says sherrod browns campaign attacked josh mandels military service	0
when the presidents spokesman was asked about anwar al awlakis son he said he should have chosen a more responsible father	1
because of barack obama 32 million new people will have healthcare	1
monarch butterflies are becoming extinct because of increased use of crops genetically modified to withstand pesticides	1
the climate change agreement between the united states and china requires the chinese to do nothing at all for 16 years	0
8 years of the clintons major losses for democrats across the nation	1
americans invented the automobile	0
while exxon mobil has 40 pages on its media response strategy its plan for resource protection is only five pages long and its plan for oil removal is just nine pages long	1
new energy standards will take away our freedom of choice and selection in the light bulbs we have in our homes	0
weve had about 3 000 murders in connection with lax border security	0
during his tenure as mayor he saw houstons crime rates drop to the lowest levels in more than 25 years	1
cuba wants to let the chinese drill in some of the very parts of the gulf that american producers are currently forbidden to touch as close as 45 miles off the florida coast	1
national debt plus unfunded liabilities adds up to 520 000 per american household	1
department of education officials investigating virginia tech shootings have not once gotten into the car and driven down to blacksburg to talk to the police chief or the university president or to anyone else	1
president obama said 22 times he could not authorize immigration reform by executive order	1
for four years we balanced the budget and paid off 405 billion in debt	0
americans now spend 100 days out of the year working for government before we even start working for ourselves	1
the united states is borrowing more than 40 cents of every dollar we spend	1
says salaries and benefits for wisconsin state employee comprised 8 5 percent of the 2009 2011 state budget	0
says when i voted against an increase in the minimum wage it was in the 80s	0
on redistricting	0
studies have shown that voter fraud is non existent in texas	0
recently though the media has reported on thousands of illegal voters here in the commonwealth	0
says of a failed cloture vote on nominating chuck hagel for defense secretary this is not a filibuster	0
every year there is a slightly smaller percentage of american households owning guns	1
there has been 5 trillion in debt added over the last four years	1
says mark pryor voted to give social security benefits to illegal immigrants	0
herman cain is a pro choice candidate	0
our president has labeled americans as soft	1
under the health care law everybody will have lower rates better quality care and better access	0
florida is enjoying its lowest crime rate in 39 years	1
says abortion is the most common surgery in our country	0
barack obama is the only candidate who doesn t take a dime from oil company pacs or lobbyists	1
under the democratic health plan families will be forced to spend an additional 2 100 a year to keep their current health care	0
a gas tax holiday is a gimmick that every economist says will just go into the pockets of the oil companies	1
for every extra year that a girl stays in secondary school her chance of getting infected with hiv aids decreases by half	1
donald trump has said nuclear proliferation is ok	1
we had a no child left behind a similar piece of legislation in our state a number of years ago well before the federal law and it s had a big impact here it s improved schools	1
says over 50 percent of u s job growth in june came from wisconsin	0
says nearly 29 000 oregonians almost 5 percent of all homeowners are 90 days or more delinquent on their mortgage	1
the rate in which people are working in wisconsin is almost five points higher than it is nationally	1
today it is more difficult to enlist in the u s military than it is to enroll in college	1
peter defazio will sneak in a 1 percent tax on all banking transactions	0
we have a guy who is going to be speaker of the house in four years and his name has been on the ballot one time	0
wholly domestic communication between you and your wife can go to new york to london and back and get caught up in the nsa database	1
the federal government is sending refugees to states with governors who are republicans not to the democrats	0
says that with president obamas re election state and federal income tax rates for some taxpayers will rise to roughly 65 percent	0
oregon leads the nation in number of jobs per capita in manufacturing	0
twenty five percent of our kids in foster care are there because their parents are involved in drugs	1
says ted strickland supported giving 150 billion to iranian regime that persecutes women christians and gays	0
holly turner still takes her homestead property tax exemption in fort worth	0
we fixed a loophole in the gun background record check system so that we could make our commonwealth safer	1
nato hasn t provided enough troops in afghanistan because they are still angry about us going into iraq	1
no federal official at any level is currently allowed to say merry christmas	0
thirty five states have accepted high speed intercity rail money	1
says donald trump has said he wants to be neutral on israel and the palestinians	1
the lawyer who brought the case against nationsbank said publicly that alex sink had nothing to do with the case had nothing to do with the situation and didnt know about the problems	1
if women seeking an abortion see their ultrasound the odds are pretty high theyre going to keep the baby	0
weve seen highway fatalities actually decrease in colorado since marijuana use was legalized	1
the state board of administration transparency issue got a great airing the last legislative session	0
the cost ofa gas tank fill up has risen 30 sincebarack obama became president	1
says gop primary opponents glenn grothman and joe leibham cast a compromise vote that cost 788 million in higher electricity costs	1
georgia has the countrys second highest number of fraudulent tax refund claims	1
the fbi is involved in an investigation about people in the rio grande valley who are using cocaine to buy votes	1
contrary to media reports georgias gas tax change led to no price increase at the pump	1
on the economic troubles of 2008 really the match that lit this fire was fannie mae and freddie mac	1
says the club for growth tries to defeat republicans and that its president called nancy pelosi the person i respect the most in washington	0
i was appointed u s attorney by president bush on sept 10 2001	0
obama nominee dawn johnsen called motherhood involuntary servitude	0
i m proud of the fact that i ve raised more money from small donors than anybody else and that we re getting 25 50 100 donations and we ve done very well doing it that way	1
it would be illegal for the fulton county commission to raise the county tax rate	1
the incidents of threats against president barack obama are greater than for any other president in modern times	0
if the trans pacific partnership is fast tracked through the senate it wont receive a committee assignment and the consideration will include no debate	0
the latino unemployment rate is higher than the white rate and the black rate is higher than the latino rate	1
we the bishops of the united states can you believe it in 1919 came out for more affordable more comprehensive more universal health care	1
when george bush took office president clinton a democrat and the democratic congress at the time had left an annual budget that was in surplus	0
if the government shuts down all military personnel will continue to serve and accrue pay but will not actually be paid until appropriations are available	1
my border security efforts have led to a 60 percent decrease in border crime	0
when mitt romney was the governor of massachusetts he performed 100 and im not sure this number is right but my mind says its about 180 gay marriages	0
more businesses are closing than opening in virginia today	0
more people were killed in the united states last year by tainted food than u s troops killed in iraq and afghanistan since the wars began	0
says tammy baldwin voted to gut medicare for seniors	0
guantanamo detainees get taxpayer paid for prayer rugsthey had honey glazed chicken and rice pilaf	1
greece is not a big economy its about the size of metropolitan miami	1
on sandra day o connor i think one reason she was a good judge is she had no judicial experience before she joined the supreme court	0
says hes the first aggie governor of texas	1
ted cruz helps run two national organizations that have been leading the push to give amnesty to illegal immigrants	0
latinos now make up the majority population in texas	0
we had a three hour debate no discussion about the national debt very little about the economy	1
